<?xml version="1.0" encoding="UTF-8"?>
<grille
  xmlns:xsi="http://www.w3.org/2001/XMLSchema-instance"
  xsi:noNamespaceSchemaLocation="projet.xsd
">
	<colonne>
		<ligne/>
		<ligne />
		<ligne/>
		<ligne/>
		<ligne/>
		<ligne/>
	</colonne>
	<colonne>
		<ligne joueur="jaune" coup="2"/>
		<ligne joueur="jaune" coup="4"/>
		<ligne joueur="jaune" coup="8"/>
		<ligne joueur="jaune" coup="10"/>
		<ligne/>
		<ligne/>
	</colonne>
	<colonne>
		<ligne joueur="rouge" coup="1"/>
		<ligne joueur="rouge" coup="3"/>
		<ligne joueur="rouge" coup="5"/>
		<ligne joueur="jaune" coup="6"/>
		<ligne/>
		<ligne/>
	</colonne>
	<colonne>
		<ligne joueur="rouge" coup="7"/>
		<ligne/>
		<ligne/>
		<ligne/>
		<ligne/>
		<ligne/>
	</colonne>
	<colonne>
		<ligne joueur="rouge" coup="9"/>
		<ligne/>
		<ligne/>
		<ligne/>
		<ligne/>
		<ligne/>
	</colonne>
	<colonne>
		<ligne/>
		<ligne/>
		<ligne/>
		<ligne/>
		<ligne/>
		<ligne/>
	</colonne>
	<colonne>
		<ligne/>
		<ligne/>
		<ligne/>
		<ligne/>
		<ligne/>
		<ligne/>
	</colonne>
</grille>
